{
	"$schema": "https://raw.githubusercontent.com/orochibraru/baba/refs/heads/main/schema/config.schema.json",
	"machineName": "my-server",
	"logLevel": "info",
	"intervalSeconds": 60,
	"reminderIntervalMinutes": 30,
	"database": {
		"path": "/var/lib/baba/incidents.json"
	},
	"checks": {
		"cpu": {
			"enabled": true,
			"usageThresholdPercent": 90,
			"consecutiveBreaches": 3
		},
		"load": {
			"enabled": true,
			"threshold": 8,
			"consecutiveBreaches": 3
		},
		"memory": {
			"enabled": true,
			"usageThresholdPercent": 90,
			"consecutiveBreaches": 3
		},
		"disk": {
			"enabled": true,
			"usageThresholdPercent": 90,
			"volumes": ["/"]
		},
		"temperature": {
			"enabled": false,
			"cpuThresholdCelsius": 85,
			"gpuThresholdCelsius": 85,
			"consecutiveBreaches": 3
		},
		"gpu": {
			"enabled": false,
			"vramThresholdPercent": 90,
			"consecutiveBreaches": 3
		}
	},
	"updates": {
		"notifyEnabled": true
	},
	"notifiers": [
		{
			"type": "discord",
			"webhookUrl": "https://discord.com/api/webhooks/<id>/<token>"
		},
		{
			"type": "telegram",
			"botToken": "123456789:AAFxxxxxxxxxxxxxxxxxxxxxxxxxxxxxxxx",
			"chatId": "-1001234567890"
		}
	]
}
